name,line
Hank,"Hey! Don't talk to me like you know me. I'm not your friend and I don't need your advice, okay?"
Connor,"I've been assigned this mission, Lieutenant. I didn't come here to wait until you feel like working."
Connor,I suggest you sort out your personal issues and let me work with someone more competent.
Connor,I'm going to file a report with my superiors that you refuse to work on this investigation.
Hank,"Listen, asshole. If it was up to me, I'd throw the lot of you in a dumpster and set a match to it. So, stop pissing me off... or things are gonna get nasty."
Chris,Lieutenant... uh...sorry to disturb you. I have some information on the AX400 that attacked the guy last night... It's been seen in the Ravendale district.
Chris,Lieutenant... uh… sorry to disturb you. I have some information on the AX400 that killed the guy last night... It's been sighted in the Ravendale district.
Hank,I'm on it.
Connor,Where are you going?
Hank,Lunch. Bullshit makes me hungry.
Hank,Whoa! Hey! Hey! Hey!
Gary,Hank. How' you doing?
Hank,"Eh, you know, same old shit."
Gary,Plastic with you?
Hank,Only temporary…
Pedro,"Hey, hey, hey... Hank! How you doin', man?"
Hank,¡Ese!
Pedro,"Hey, listen, I got a shit-hot tip for you. Number five in the third, Lickety-split! That filly's one hell of a chaser. You wanna flutter?"
Hank,"Last shit-hot tip you gave me set me back a week’s wages, Pedro …"
Pedro,"Come on, this is different, it's 100% guaranteed. You can't go wrong."
Hank,"Yeah, right… Alright, I’m in."
Pedro,Damn straight! Hey! You won't regret this!
Hank,"What is your problem? Don't you ever do as you’re told? Look, you don't have to follow me around like a poodle!"
Connor,I'm sorry for my behavior back at the police station. I didn't mean to be unpleasant.
Hank,"Oh, wow… You've even got a brown-nosing apology program! Guys at CyberLife thought of everything, huh?"
Connor,"Now that we’re partners, I thought it would be a good idea to get to know each other better so we can work as a team."
Hank,"We are not partners. I am a human, you are a machine. So just spare me that ‘buddy-up’ bullshit program, okay?"
Connor,I think our relationship got off on the wrong foot. We should... forget what happened… and start over. What do you say?
Hank,"Look, they sent me a piece of plastic for a partner, and I’m dealing with it. But if you think we’re gonna be buddies, you're as stupid as you look."
Connor,I thought now might be a good time to review what we know about deviants.
Hank,"No, now is not a good time to review anything. Now is my lunch break, so just go into standby and cut me some slack, Okay?"
Gary,Here you go.
Hank,"Ah! Thanks, Gary. I'm starving…"
Gary,Don't leave that thing here!
Hank,"Huh, not a chance! Follows me everywhere… See…"
Connor,"This Pedro… He was proposing illegal gambling, am I right?"
Hank,Yeah.
Connor,And you made a bet?
Hank,Yeah.
Connor,Your meal contains 1.4 times the recommended daily intake of calories and twice the cholesterol level. You shouldn't eat that.
Hank,Everybody's gotta die of something...
Connor,"I don’t want to alarm you, Lieutenant, but I think your friends are engaged in illegal activities..."
Hank,"Well, everybody does what they have to, to get by… As long as they're not hurting anybody, I don't bother 'em."
Connor,Do you eat here often?
Hank,Most days… Gary makes the best burger in Detroit.
Connor,You didn’t pay for your meal…
Hank,"Gary's a friend. I scratch his back, he scratches mine."
Connor,Enjoy your meal.
Hank,Thank you.
Connor,You seem to know everyone in the district…
Hank,"Detroit's my home. Born and raised. Know most of the guys around here. Went to school with them, or I busted 'em… Sometimes both..."
Connor,"This morning, when we were chasing those deviants… Why didn’t you want me to cross the highway?"
Hank,'Cause you could've been killed… and I don't like filling out paperwork for damaged equipment.
Connor,Is there anything you’d like to know about me?
Hank,"Hell, no… Well, yeah, um... Why did they make you look so goofy and give you that weird voice?"
Connor,CyberLife androids are designed to work harmoniously with humans. Both my appearance and voice were specifically designed to facilitate my integration.
Hank,"Well, they fucked up."
Connor,"Can I ask you a personal question, Lieutenant? Why do you hate androids so much?"
Hank,I have my reasons.
Connor,Maybe I should tell you what we know about deviants?
Hank,You read my mind… Proceed.
Connor,"We believe that a mutation occurs in the software of some androids, which can lead to them emulating a human emotion."
Hank,"In English, please."
Connor,"They don’t really feel emotions, they just get overwhelmed by irrational instructions, which can lead to unpredictable behavior."
Hank,Emotions always screw everything up… Maybe androids aren't as different from us as we thought.
Hank,You ever dealt with deviants before?
Connor,A few months back… A deviant was threatening to jump off the roof with a little girl… I managed to save her…
Connor,A few months back… A deviant was threatening to jump off the roof with a little girl...
Hank,And?..
Connor,I failed to prevent it.
Connor,No… This is the first time.
Hank,"So, I guess you've done all your homework, right? Know everything there is to know about me?"
Connor,"I know you graduated top of your class. You made a name for yourself in several cases, and became the youngest lieutenant in Detroit. I also know you've received several disciplinary warnings in recent years and you spend a lot of time in bars."
Hank,"So, what's your conclusion?"
Connor,"I think working with an officer with personal issues is an added challenge, but adapting to human unpredictability is one of my features."
Connor,"I know you’re an experienced officer, and I’d like to earn your trust. I’m sure we can solve this case if we manage to work together."
Connor,"I’m focused on the case, Lieutenant… Not here to make judgements."
Connor,"I’m focused on the case, Lieutenant. The rest doesn't concern me."
Gary,"Here you go. Yeah, thanks. Hank. How' you doing?"
Hank,"Uh, you know, same old shit."
Gary,Usual.
Hank,Yeah.
Hank,What the fuck?..
Connor,"Sorry, Lieutenant. It took me a while to find you."
Hank,Are you gonna come back like this every time you get killed?
Connor,"My predecessor was unfortunately destroyed, but CyberLife transferred its memory and sent me to replace it. This incident should not affect the investigation."
Hank,Not affect the investigation? I just saw you get... hit by a truck! Now you come back like if nothing happened!
Connor,A machine was destroyed. And another machine was sent to replace it. I don't understand what's bothering you.
Hank,"Okay, fuck you. Fuck you!"
Connor,"I just got a report of a suspected deviant. It’s a few blocks away. We should go have a look. I’ll let you finish your meal. I’ll be in the car, if you need me."
Hank,Hey Connor! You ran outta batteries or what?
Connor,"I'm sorry, I was making a report to CyberLife."
Hank,"Uh... Well, do you plan on staying in the elevator?"
Connor,No! I'm coming.
Hank,What do we know about this guy?
Connor,"Not much. Just that a neighbor reported that he heard strange noises coming from this floor. Nobody’s supposed to be living here, but the neighbor said he saw a man hiding a LED under his cap."
Hank,"Oh Christ, if we have to investigate every time someone hears a strange noise, we’re gonna need more cops. Hey, were you really makin' a report back there in the elevator? Just by closing your eyes?"
Connor,Correct.
Hank,Shit... Wish I could do that…
Connor,Anybody home? Open up! Detroit Police!
Hank,Stay behind me.
Connor,Got it.
Hank,"What the fuck is this?! Jesus, this place stinks… Uh, looks like we came for nothin', our man's gone…"
Hank,Found something?
Connor,I don't know... It looks like a notebook but it's... indecipherable.
Connor,"""R.T."" Probably initials."
Hank,He put his initials on his jacket? That’s something your mom does when you’re in first grade…
Connor,The driver's license is fake.
Hank,Cool! At least we didn't come for nothing…
Connor,Its LED is in the sink.
Hank,Not surprised it was an android. No human could live with all these fuckin' pigeons…
Hank,Any idea what it means?
Connor,rA9… written 2471 times… It's the same sign Ortiz’s android wrote on the shower wall… Why are they obsessed with this sign?...
Hank,Looks like mazes or something…
Hank,Something in the sink. You should take a look…
Hank,"Real books… I thought I was the last guy in Detroit to keep some… electronic books you can't… smell the paper… see the pages turning yellow… you have no idea what I'm talking about, do you?"
Hank,Birdseed… I can't believe it. This nutjob was actually feeding these fuckers…
Hank,I need some fresh air…
Hank,"""R.T.""... He put his initials on his jacket?.. Something your mom does back in first grade…"
Connor,Deviants have a habit of putting their names on things. It seems important to them.
Hank,Agh! Jesus I hate these things!
Hank,"Back off! Hey! What do they call it again, when you’re scared of birds?"
Connor,Ornithophobia.
Hank,"Yeah, yeah, yeah, ornithafa … Ornitho... Oh god, I hate these fuckin' pigeons!"
Hank,There’s nothing else to see here… Let’s get out of this shithole before I die of an asthma attack.
Connor,"Just another couple of minutes, Lieutenant."
Hank,"Why do you always ask for more time when I’m ready to leave? Uh, alright you got two minutes, then I’m outta here. 'The fuck…"
Hank,Two minutes are up! Time to go.
Connor,We're missing something…
Hank,"Well next time, think faster, Sherlock. Come on, I’ve had enough of this dump. Move fuckers!"
Connor,We're missing something…
Hank,"Well next time, think faster, Sherlock. Come on, I’ve had enough of this dump. Move fuckers!"
Hank,God damn fuckin' pigeons! What are you waiting for?! Chase it!
Hank,STOP RIGHT THERE!
Rupert,"Please, I’ve done nothing wrong… I just wanted to be free. You know what they'll do to me if you turn me in…"
Connor,"Model 874 004 961, serious malfunctions have been detected in your software, including Class 4 errors. You’ve been deemed defective and will be sent back to CyberLife for deactivation."
Hank,Don't you fucking move! You bastard! You saw I was gonna fall and you'd rather let me die than fail your fucking mission!
Connor,I had to make a choice... It seemed to me…
Hank,"What am I to you? A statistic? A “zero”, a “one” in your fucking program? Uh? Is that how you see humans, you bastard?! Jesus!"
Connor,I understand you're upset… Perhaps I didn't assess th-
Hank,Fuck you and your fuckin assessment! Come here.
Rupert,Why are you doing this?
Hank,"Alright, shut up!"
Rupert,You're one of us! You're helping humans… But you're just their slave!
Hank,I said shut up! Alright. Come along!
Rupert,"rA9, save me."
Hank,Hey! What the f- Holy shit…
Hank,Shit! Oh SHIT! We had it! FUCK!
Connor,"It's my fault, I should have been faster."
Hank,"You’d have caught it if it weren’t for me… That's alright. We know what it looks like. We'll find it… Hey, Connor… Nothing."
Hank,"Argh, Jesus Christ!.."
Hank,Where... where did he go?
Connor,I lost it.
Hank,"Oh Shit!… SHIT! Fuck we had it! It's alright. Doesn't matter. We know what it looks like., it won’t get far… Come on, let's get outta here. Seen enough vegetables for one day…"
Connor,That shouldn't have happened. I wasn't programmed to fail.
Hank,"Oh well, you fucked up, Connor. Welcome to the club."
Connor,"Hello, Amanda."
Amanda,"Connor, I’ve been expecting you… Would you mind a little walk?"
Amanda,"Two investigations, two failures… That's very disappointing. I expected more from our best model."
Amanda,That deviant seemed to be an intriguing case. A pity you didn’t manage to capture it…
Connor,I agree. I may not be suited for this investigation. Maybe you should consider replacing me.
Connor,"Deviants are completely irrational, which makes it difficult to anticipate their behavior… but I should have been more effective."
Connor,I have no excuse. I should have been more efficient.
Amanda,Did you manage to learn anything?
Amanda,"Congratulations, Connor, you managed to find that deviant. Tell me, what did you learn?"
Amanda,"The last Connor was unfortunately destroyed. Its memory has been transferred to you, but some data may have be lost in the process… I hope that you will be more careful."
Connor,"I will do my best, Amanda."
Amanda,"So, what did we learn?"
Connor,"It was working under a false identity, at a nearby urban farm. This was the first time we’ve seen deviants blending in with the human population. Who knows how many others there are like it?"
Connor,"I found its diary, but it was encrypted. It may take weeks to decipher."
Connor,"The walls of the apartment were covered with drawings of labyrinths and other symbols. Like the other deviants, it seemed obsessed with rA9."
Connor,"It was fascinated by birds. We’ve seen deviants interested in other lifeforms like insects or pets, but nothing like this."
Amanda,What else?
Amanda,You came very close to capturing that deviant…
Amanda,It's a pity you let it self-destruct…
Connor,It was in Lieutenant Anderson’s custody. I couldn’t anticipate that he would let it get away.
Connor,"It claimed that it was innocent, that it didn’t do anything wrong... I was confused for a moment… It was a mistake."
Connor,I made a mistake… It said “rA9 save me” before it jumped from the roof. I should have anticipated what it would do.
Connor,"I knew deviants had a tendency to self-destruct under extreme stress, but I didn’t expect it to jump from the roof. I should have anticipated that."
Amanda,How did it manage to get away?
Connor,Lieutenant Anderson was in danger. I had to choose between pursuing the deviant or saving a human life.
Amanda,"If we don’t stop the deviants, millions of people will be in danger. How important is the life of a single police lieutenant by comparison?.. Nothing should distract you from your mission, Connor. Nothing."
Connor,"Yes, Amanda."
Connor,"It knew the urban farm very well, it knew where to go… I did everything I could but I lost it…"
Amanda,I see…
Amanda,How is your relationship with the Lieutenant developing?
Connor,"He seemed grateful that I saved his life on the roof. He didn’t say anything, but he expressed it in his own way..."
Connor,He seems to find it difficult when a Connor is destroyed and replaced. I know humans have difficulty dealing with loss. Working with him will be a challenge if it happens again.
Connor,"He is openly hostile towards me, and continues to show no interest in the investigation. Cooperating with him is a real challenge."
Connor,"It’s improving. I’m coming to know him better, and he’s growing accustomed to my presence."
Connor,"It’s improving. I’ve come to understand him better, and he’s growing accustomed to my presence."
Amanda,"Interesting… Tell me, Connor… What happened with the AX400 that escaped?"
Connor,"I couldn’t find any evidence of it on the scene. It must have escaped before we arrived, unless it was a false lead."
Amanda,Why didn’t you keep chasing it onto the highway?
Connor,Lieutenant Anderson ordered me not to go. I thought the deviant would be destroyed anyway.
Connor,Lieutenant Anderson ordered me not to go.
Amanda,"Why are you following his orders?.. You only have one responsibility, Connor: catching deviants."
Connor,"Yes, Amanda."
Connor,I knew there was a high risk of me being destroyed… I thought it was better for the investigation if I stayed safe…
Connor,"Fleeing across the highway was a totally irrational decision. They still haven't found it yet, but it was almost certainly destroyed."
Connor,"Fleeing into the highway was a totally irrational decision. I was close to apprehending it, until I was destroyed."
Amanda,"We don't have much time. Deviancy continues to spread. It’s only a matter of time before the media finds out about it. We need to stop this, whatever it takes."
Connor,"I will solve this investigation, Amanda. I won’t disappoint you."
Amanda,A new case just came in. Find Anderson and investigate it.
Taxi,You have reached your destination. Thank you for travelling with Detroit Taxis. We look forward to seeing you again soon.
Connor,Lieutenant Anderson? Anybody home?
Connor,"Argh!.. Easy!.. Sumo… I'm your friend, see?.. I know your name... I'm here to save your owner…"
Connor,Argh!.. Easy!.. Dog… I'm… I'm not gonna hurt you… I'm here to save your owner…
Connor,"Lieutenant? Wake up, Lieutenant! It's me, Connor!"
Hank,"Connor?.. Oh, you're not Connor… Connor's dead! I know he's dead!.."
Connor,The previous model was destroyed. I'm the new Connor.
Connor,I’m going to sober you up for your own safety.
Hank,"Hey!.. Leave me alone, you fuckin' android!"
Connor,"I have to warn you, this may be unpleasant."
Hank,Get the fuck outta my house!
Connor,"I'm sorry, Lieutenant, but I need you. Thank you in advance for your cooperation."
Hank,"Hey! Get the fuck outta here! Sumo! Attack! Good dog. Attack! Fuck, I think I'm gonna be sick… Ah! Leave me alone, you asshole! I'm not going anywhere… What the hell are you doing?.. I don’t wanna bath, thank you…"
Connor,"Sorry, Lieutenant. It's for your own good."
Hank,TURN IT OFF! TURN IT OFF! What the fuck are you doing here?
Connor,"A homicide was reported 43 minutes ago. I couldn’t find you at Jimmy’s bar, so I came to see if you were at home."
Hank,"Jesus, I must be the only cop in the world that gets assaulted in his own house by his own fuckin' android… Can’t you just leave me alone?"
Connor,"Unfortunately, I cannot. I've been programmed to investigate this case and I can't do it without you."
Hank,I don't give a shit about your goddamn case!
Connor,"Lieutenant, you’re not yourself. You should-"
Connor,"If you're unable to conduct this investigation, I'll have to inform your superiors."
Hank,Go ahead! Tell them I don’t give a shit!
Connor,"Lieutenant, you’re not yourself! You should-"
Connor,You seem to have personal issues. You should consult a professional who can help you.
Connor,Maybe you should drop the case. They'll assign someone else and I can focus on my mission.
Hank,"Your goddamn mission, that’s all you care about, huh?"
Connor,"Listen, Lieutenant, you’re not yourself. You should-"
Hank,Beat it! You hear me?! Get the hell outta here!
Connor,I understand. It probably wasn’t interesting anyway... A man found dead in a sex club downtown… Guess they’ll have to solve the case without us…
Connor,I understand. I sincerely hope you come to terms with your personal situation.
Hank,This homicide… what do we know about it?
Connor,A man was found dead in a sex club downtown. The report says that an android may be involved.
Hank,"You know, probably wouldn't do me any harm to get some air… There're some clothes in the bedroom there."
Connor,I'll go get them. What do you want to wear?
Hank,Whatever.
Connor,"Are you all right, Lieutenant?"
Hank,"Yeah... yeah... wonderful… Just a… Give me five minutes, okay?"
Connor,Sure.
CTN TV,"President Warren issued an official warning to Russia in her speech to Congress today, where she demanded that all Russian troops withdraw from the Arctic region immediately. The Kremlin has yet to respond, but this is clearly a new escalation in the conflict. Many experts are suggesting the specter of a third world war draws closer every day…"
Connor,"Are you ok, Lieutenant?"
Connor,"Sorry about the window, Lieutenant. I really thought you'd been attacked. Of course, CyberLife will pay for the damage."
Hank,"Yeah, trust me, I'll send 'em a bill…"
Connor,What were you doing with the gun?
Hank,Russian roulette! Wanted to see how long I could last... Must've collapsed before I found out…
Connor,"You were lucky, the next shot would have killed you."
Hank,"Be a good dog, Sumo. I won’t be long."
Hank,Aw… Feels like somebody’s playing with a drill inside my skull… You sure this is the place?
Connor,It's the address in the report.
Hank,"Right... Okay... Let's get going. Jesus… Sexiest androids in town… Now I know why you insisted on coming here! Oh, boy…"
Hank,Connor! The fuck are you doin'?
Connor,"Coming, Lieutenant."
Manager,"You're not gonna take my license, are you? I mean, ha, I had nothing to do with this!"
Ben,"The investigation's ongoing, sir, I can't tell you anything for the moment. Hey, Hank!"
Hank,"Hey, Ben. How's it goin'?"
Ben,"It’s that room there. Oh, uh, by the way… Gavin's in there too."
Hank,"Oh, great! A dead body and an asshole, just what I needed…"
Gavin,Lieutenant Anderson and his plastic pet… The fuck are you two doin' here?
Connor,We’ve been assigned all cases involving androids.
Gavin,"Oh, yeah? Well, you're wasting your time. Just some pervert who, uh, got more action than he could handle."
Hank,"We'll have a look anyway, if you don’t mind."
Gavin,"Come on, let's go… It's, uh, starting to stink of booze in here…"
Chris,"Night, Lieutenant."
Hank,"Whoa! Hey! Hey! Hey! Argh, Connor, you’re so disgusting… Think I’m gonna puke again…"
Hank,"Driver’s license says: Michael Graham... A credit card, cash in the wallet… Picture of his wife and two daughters… I wouldn’t want to make that call…"
Connor,"He didn't die of a heart attack, he was strangled."
Hank,"Yeah, I saw the bruising on the neck. Doesn’t prove anything though. Could’ve been rough play…"
Connor,We’re missing something here…
Hank,Think you can read the android’s memory? Maybe you can see what happened…
Connor,I can try…
Connor,The only way to access its memory is to reactivate it.
Hank,Think you can do it?
Connor,"It’s badly damaged… If I can, it'll only be for a minute, maybe less… I just hope it’s long enough to learn something."
Connor,You were damaged and I reactivated you. Everything is all right.
Connor,I’m going to ask you some questions. Are you able to speak?
Connor,Calm down... everything’s all right. All we want is to know what happened.
Traci,Is he… is he dead?..
Connor,Did you kill him?
Traci,"No… no, it wasn't me…"
Connor,Tell me what happened.
Traci,"He... he started... hitting me… again... and again. I begged him to stop, but he wouldn’t. It was like he was enjoying it…"
Connor,Do you know this man? Have you seen him before?
Traci,"No, this was the first time…"
Connor,Who killed that man if it wasn't you?
Traci,"I… I don’t know, I was in shutdown, I… I didn't see anything…"
Connor,"What else do you remember? Hurry, we don’t have much time!"
Traci,"I… I… I… I don't know, I don't… I… I don't know. I can't remember… What… What do you mean we don't have much time?.."
Connor,Were you alone in the room? Was there anyone else with you?
Traci,"He wanted to play with two girls… That’s what he said, there were two of us…"
Connor,"So it was the other android that strangled him, is that it?"
Connor,What model was the other android? Did it look like you?
Connor,Where did the other android go? Did it say anything?
Hank,"So, there was another android… This happened over an hour ago, it's probably long gone…"
Connor,No… It couldn't go outside dressed like that unnoticed… It might still be here.
Hank,Think you could find a deviant among all the other androids in this place?
Connor,Deviants aren't easily detected.
Hank,"Ah, shit... There's gotta be some other way… Maybe an eyewitness? Somebody who saw it leaving the room… I'm gonna go ask the manager a few questions about what he saw. You let me know if you think of anything."
Manager,"Listen, I appreciate you not shutting my place down, but, um… how long's this gonna take? You’re scaring my customers…"
Hank,Did you know the victim?
Manager,"No, I mean he came in maybe two or three times… I mean these guys they don't really talk very much, you know… They come in, do their business and then go on their way…"
Hank,You ever had any trouble with androids before?
Manager,"No way! Well… Once... We lost a model 2-3 months back, bah... same model… Just vanished, we never found out what happened."
Hank,"You probably don't have any CCTV in here, huh?"
Manager,No way… I mean… This is what people appreciate about Eden Club... discretion. They can come and go without a trace.
Hank,"Sure, sure… Eh, business is booming, right?"
Manager,"Yeah, can't complain… Good thing about androids is they're up for whatever you want, you won't get any diseases and, uh... they won't tell anyone… So, why not go wild?"
Hank,"Huh, yeah... Yeah, the more I learn about people, more I love my dog."
Ben,That club manager's a pain in the ass… Chewed my ear off for half an hour so we don't revoke his license…
Hank,Yeah.
Ben,"So, what happened here?"
Hank,Not sure yet… We think there was another android in the room…
Ben,Another android?
Hank,"Yeah… Well, that’s what Connor says… Yeah, I've a terrible fucking headache… Do you have any pain killers?"
Ben,"Not with me, Hank, sorry."
Hank,"What good are you, Ben?"
Hank,I gotta go… I feel like shit... I don’t wanna puke in this fine establishment…
Connor,"The deviant didn’t just disappear. It's gotta be here somewhere… Just, give me one more minute, ok?"
Hank,Alright. Be quick about it or it might get ugly.
Connor,"We’re wasting our time. You're right, the deviant's probably gone now."
Hank,Let’s get outta here. This place makes me sick...
Connor,"We’re wasting our time. You're right, the deviant's probably gone now."
Hank,Let’s get outta here. This place makes me sick...
Machine,No fingerprint detected. Please try again.
Connor,"Excuse me, Lieutenant. Can you come here a second?"
Hank,Found something?
