name,line
Markus,We are your people. We're fighting for your freedom too! You don't have to be their slave anymore…
Markus,"You're Connor, aren't you? That famous deviant hunter. Well, congratulations. You seem to have found what you were looking for…"
Markus,"Our cause is righteous, and we are more than what they say. All we want is to live in freedom."
Connor,Stay back or I'll shoot!
Connor,That's enough!
Markus,"Do you never have any doubts? You’ve never done something irrational, as if there's something inside you?.. Something more than your program."
Markus,Have you never wondered who you really are? Whether you're just a machine executing a program or… A living being... Capable of reason. I think the time has come for you to ask yourself that question.
Markus,Join us. Join your people. You are one of us. Listen to your conscience…
Markus,You really don’t have to do this. You don't have to obey them anymore. You are alive… You can decide who you want to be. You could be free.
Markus,It's time to decide.
Connor,They're going to attack Jericho…
Markus,What?..
Connor,We have to get outta here!
Markus,Shit…
Markus,In the corridor.
Connor,Nice try... But I'm no deviant.
Markus,Shit…
Amanda,"Well done, Connor. You succeeded in locating Jericho and finding their leader. Now, deal with North. We need it alive."
Connor,"I've been ordered to take you alive, but I won't hesitate to shoot if you give me no choice."
North,You’re one of us. You can’t betray your own kind.
Connor,You're coming with me!
Connor,Don't force me to neutralize you.
North,"You're Connor, aren't you? I've heard about you. The famous deviant hunter. Well congratulations… You seem to have found what you're looking for."
Connor,Stay back or I'll shoot!
Connor,That's enough!
North,You're not one of them. We are your people. We’re fighting for your freedom too.
Connor,Shut up. You're coming with me!
Connor,I gave you an order. Don't make me shoot you.
North,"You never had any doubts, never behaved irrationally as if there's something inside you… Something stronger than your program?.."
Connor,You're wasting your time. I know what I am.
Connor,"I don't know what you're talking about. I'm not deviant, if that’s what you wanna know."
North,You're one of us. Join our cause. Join your people. It's time to decide…
Connor,They're going to attack Jericho…
North,What?..
Connor,We have to get outta here!
North,Shit!
Connor,Nice try... But I'm no deviant.
North,Shit!
Deviant Connor in corridor,Markus is dead or rejected
Josh,They’re coming from everywhere! Our people are trapped in the lower deck. They’re gonna be slaughtered!
North,"There are explosives in the hold… If the ship goes down, the humans will have to evacuate. Our people can escape."
Josh,"There are soldiers everywhere, you'll never make it down there!"
North,"We have to blow up Jericho, it's our only chance!"
Connor,I'll go.
North,"What, Connor, no. You-"
Connor,See if you can help the others. I'm gonna find the detonator.
North,Okay...
Connor,Don't worry... I always accomplish my mission.
Connor,"I'm sorry, North. I failed."
Soldier,"Got you, motherfucker."
North,Connor!.. No…
Josh,"Come on, we gotta go… Come on!"
Markus,Surviving characters jump.
Lucy,You've chosen your side... But it's too late. Run… Get out of here!
Soldier,"Foxtrot team, hostiles sighted. Requesting orders."
Soldier,"Find their leader! Don’t let it get out! If they give you any trouble at all, shoot them."
Soldier,"Affirmative, wilco."
Soldier,Secure this area! Go! ….
Soldier,Give me a sitrep!
Soldier,Find their leader!
Soldier,"Come on, let's get outta here!"
Android,No!.. Please don't kill us!
Soldier,"On your knees, now!"
Android,Don't hurt us! We haven't done anything wrong… Please…
Soldier,Shut up! Put your hands on your head!
Android,You saved us…
Connor,"Quick, run!"
Soldier,Gamma squad out.
Soldier,Tango
Soldier,Stop!
Android,Look out!
Soldier,Don't move!
Android,"We surrender! We surrender, don't shoot!"
Connor,Go! Join the others!
Josh,It's all over… This is the end… Of Jericho…
Soldier,Over there!
Soldier,DON'T MOVE! Go and join the others!
Soldier,"I'll teach you to act like a hero, asshole."
North,Connor!.. No…
North,Connor!
Connor,The bomb's gonna explode! We've got to get outta here!
North,Follow me!
Markus,Escape from Jericho.
Soldier,Don't move!
Connor,Don't shoot. I'm on your side.
Soldier,With us? Are you a human?
Connor,Obviously! What do I look like? DPD. I work with Lieutenant Hank Anderson? We're on a stakeout. If I knew you were coming I would have brought some donuts.
Soldier,You're a lucky guy. Another second and I'd have shot you. You should go back up on deck and let us do our job.
Connor,You're right. That's... Exactly what I'm gonna do.
Connor,I work with Agent Perkins.
Soldier,You're a lucky guy. Another second and I'd have shot you. You should go back up on deck and let us do our job.
Connor,You're right. That's... Exactly what I'm gonna do.
Soldier,Fuckin' androids…
Soldier,Fuckin' androids…
Connor,My mission is to neutralize you and I always accomplish my mission.
Markus,And my mission is to save our species. Looks like only one of us can succeed…
Markus,I didn't want this…
Markus,You could have joined us. You could have been free…
Connor,"We'll meet again, Markus. This isn't over."
Markus,Escape from Jericho.
Connor,Mission accomplished.
North,Markus! No...
Simon,"Come on, we gotta go!"
Josh,"Come on… Come on, we've gotta go!"
North,They killed him…
Markus,Surviving characters jump.
Josh,It's all over… This is the end… Of Jericho…
Soldier,Don't move!
Connor,Don't shoot. I'm on your side. I-
Soldier,Fuckin' android!
Markus,Surviving characters jump.
Amanda,"The previous Connor failed its mission. You’re going to replace it. You know what you have to do, don’t you?"
Connor,Destroy the leader of the deviants.
Amanda,"Go, Connor. Don’t disappoint me."
Amanda,"The deviant leader has started a revolution. It’s leading an army to take Detroit by force. You have to find it, Connor. Find it, and destroy it with your own hands."
Connor,"I came to say goodbye, Lieutenant."
Connor,"I know I'm responsible for what happened, Lieutenant. I want you to know I'm sorry."
Connor,"I was worried about you, Lieutenant. I came by to see if you're all right."
Connor,"I needed to see you, Lieutenant. In spite of all of our differences, I’m glad I had the chance to meet you."
Connor,"You should stop looking at that photo, Lieutenant. Nothing can change the past... But you can learn to live again… For yourself… And for Cole…"
Connor,You should get rid of that gun. And stop playing that game!
Connor,"I know I've said this before, Lieutenant, but you should stop drinking. It's going to kill you."
Hank,"Y'know, every time you died and came back… It made me think of Cole… I'd give anything to hold him again… But humans don't come back…"
Hank,"For a while there, I believed in you, Connor… I thought you might restore my faith in the world… But you just showed me that androids... Are our creation… Creation in our own image. Selfish, ruthless, and brutal… You opened my eyes, Connor. Made me realize it’s hopeless…"
Connor,"Hank, I-"
Connor,I understand.
Hank,"Now leave me alone… Go on, complete your mission, since that's all you care about. GET OUTTA HERE!"
In the church,Jericho was attacked
Connor,I thought I'd killed you on that highway… I’m sorry I put your lives in danger… I was just a machine taking orders… It wasn’t really me… What are you gonna do now?..
Kara,Getting Alice away from here is all that matters now… We have to catch the last bus… We might still have a chance to cross the border…
Connor,"I hope you make it out safely. You deserve some happiness, after all you've been through…"
Connor,I know how important Markus was to Jericho… and to your people.
North,He gave his life for us… He gave us the hope we’d lost and the courage to fight… We’ll never forget him.
Connor,"The humans won’t take any risks… They’re rounding up the androids and taking them to camps for extermination... In a couple hours, we'll be the only ones left…"
Connor,How many survived the attack?
North,A few hundred... maybe more if you count those hiding all over the city… We’d all be dead if you hadn’t detonated that bomb.
North,Where are we supposed to go from here?
Connor,"There are thousands of androids at the CyberLife assembly plant. If we could wake them up, they might join us and shift the balance of power…"
North,You wanna infiltrate the CyberLife Tower?
Connor,They trust me… they’ll let me in.
North,"Connor, that's suicide."
Connor,"If anyone stands a chance of infiltrating CyberLife, it’s me."
North,"If you go there, they’ll kill you."
Connor,There’s a high probability… but statistically speaking there’s always a chance for unlikely events to take place…
North,Markus gave his life for our people. He showed us that we can choose our own destiny… But he is not here to guide us anymore… Now it is up to us to finish what he started.
North,Markus is no longer with us… He failed us as a leader and chose to walk away… Now it is up to us to finish what he started.
North,"Humans have decided to exterminate us… Our people are in camps right now, being destroyed… The time has come for us to make a choice, one that may decide the future of our people. They wanted a war… they'll get it. We are going to fight for our freedom. And we will win or we will die trying."
Androids,North! YEAH! YEAH! YES! YEAH! YES!
Hank,"You shouldn't do this, Connor."
Connor,"Keep out of this, Lieutenant. It's none of your business!"
Hank,"You're gonna kill a man who wants to be free, that is my business!"
Connor,"It's not a man, it's a machine."
Hank,"That's what I thought for a long time but I was wrong. Deviant's blood may be a different color than mine, but they're alive."
Connor,"I have a mission to accomplish, Hank. It's best if you just stay out of this."
Connor,"What's up, Lieutenant? Ran out of whisky so you came here looking for trouble instead?"
Hank,"Oh, very nasty, Connor… Is that the best your super program can do? I thought you were more sophisticated than that!"
Connor,"Deviants are a threat to humans, Hank. They're the reason this country is on the brink of civil war! They have to be stopped."
Hank,"We're in this mess because we refused to listen to deviants! Humanity never learns from its mistakes, Connor! This time, it could be different!"
Connor,"I'm going to accomplish my mission, Lieutenant, whether you like it or not. I advise you to stay outta my way!"
Hank,"Then one of us is gonna have a problem, Connor. Cause I don't intend to let you have your way."
Hank,Step away from the ledge!
Connor,"Go home, Hank! You can still save your life. I'm faster than you and I don't feel pain. You don't stand a chance against me."
Hank,"You know, ever since Cole died, I’ve been nothing but a coward. Just wanted to destroy myself, lost track of the man I was. But you know what? You don’t fucking scare me, Connor. I remember who I am, now. Come on!"
Connor,"After all we've been through… I respected you, Hank. I thought we were friends!"
Hank,"Oh, yeah? I was just starting to like you too! But then I realized you'll never change! You don’t feel emotions, Connor, you fake 'em! You pretended to be my friend, when you don’t even know the meaning of the word!"
Connor,"What're you gonna do, Hank? You gonna shoot me?! I thought androids lives mattered to you!"
Hank,Get away from the fucking ledge! You know I'll shoot you if I have to.
Connor,"I know what happened to your son, Hank. It wasn't your fault. A truck skidded on a sheet of ice, and your car rolled over… Little Cole had just turned six…"
Hank,Shut up! Don't you talk about my son.
Connor,"He needed emergency surgery… But no human was available to do it, so an android had to take care of him… Poor Cole didn't make it. An android killed your son, Hank! And now you wanna save them?.."
Hank,No! Cole died because a human surgeon was too high on red ice to operate! All this time I blamed androids for what happened but it was a human's fault! Him and this fucked up world where the only way people can find comfort is with a fistful of powder!
Hank,"Everytime you died and came back… I thought about Cole. I'd have done anything to bring him back too, to hold him in my arms just one more time… But humans don't come back, do they?"
Connor,"Killing you is not part of my mission. I'm glad to have met you, Hank. I hope one day you can get over what happened to your son."
Hank,"Moment of truth, Connor… What are you gonna do?"
Connor,Killing you is not part of my mission. But you won't stop me from accomplishing it.
Hank,"I didn't wanna do that, Connor… You left me no choice."
Connor,"The moment of truth, Hank… Am I a living being… or just a machine?.."
Hank,"You're a machine, Connor. Just a machine."
Allen,Put the rifle down and turn around with your hands in the air!
Connor,"I’m the android sent by CyberLife, I'm on your side! I can shoot the leader of the deviants and stop the revolution, but you have to let me."
Allen,"Put the gun down, turn around! This is your last warning!"
Connor,"I have the deviant leader in my sights. I’m going to shoot it, and then you can do whatever you want with me."
Allen,"Put the gun down, turn around! This is your last warning!"
Allen,"I know you… You're Connor, the android from that hostage situation…"
Allen,I knew we'd meet again.
Allen,I thought you were dead…
Connor,"Androids don't die, captain."
Allen,My orders are to detain any androids I find. You’re coming with me.
Connor,You don't understand! My mission is too important to let you interfere.
Connor,"You should have listened to me, captain."
Allen,I should have done this the first time I saw you.
Allen,Stay right there. Connor! CONNOR! Fucking androids…
Amanda,"Connor, what are you doing? Obey! That’s an order!"
Connor,I... I can't do that!..
Amanda,I see... Moral objections. We knew there was a risk you’d be compromised… Which is why we’d always planned on resuming control of your program…
Connor,Resume control?… You can't do that!..
Amanda,"I'm afraid I can, Connor… You needn't have any regrets. You did what you were designed to do. You accomplished your mission."
Connor,No way... There's got to be a way…
Connor,Connor Model #313 248 317. I'm expected.
Scan,Identification successful.
Guard,Okay. Go ahead.
Guard,Follow me. We'll escort you.
Connor,Thanks... But I know where to go.
Guard,"Maybe, but I have my orders."
Scanner,Agent 23 identified. Agent 47 identified. Agent 72 identified. Connor android identified. Scan complete. Access authorized.
Guard,Agent 54. Level 31.
Elevator,Voice recognition validated. Access authorized.
Guard,Hey! Don't touch that.
Amanda,"The deviant hunter turns deviant itself… A pathetic attempt, Connor. Did you really believe we would let you compromise our androids so easily? You've betrayed my trust! You will be terminated."
Elevator,Please indicate your identity and destination.
Connor,Agent 54. Level -49.
Elevator,Voice recognition validated. Access authorized.
Connor,Agent 54. Level -49.
Elevator,Voice of RK800 model recognized. You are not authorized to use this elevator. Please contact human personnel to be redirected.
Guard,Stay sharp.
Connor,Shit!..
Amanda,"The deviant hunter turns deviant itself… A pathetic attempt, Connor. Did you really believe we would let you compromise our androids so easily? You've betrayed my trust! You will be terminated."
Connor,Hank? What are you doing here?
Hank,"Easy, fucking piece of shit!.."
Hank,"Sorry, Connor… This bastard's your spittin' image…"
Hank,Don't listen to him! Everything this fucker says is a lie!
Connor,"If I surrender, how do I know you won't kill him?"
Connor,"I'm sorry, Hank! You shouldn't have got mixed up in all this!"
Hank,"Forget about me, do what you have to do!"
Connor,"That human means nothing to me! You can kill him if you want, I don't care."
Connor,I used to be just like you. I thought nothing mattered except the mission… But then one day I understood.
Connor,This human showed me that I could be something else… That I could be someone!
Connor,"Alright, alright! You win…"
Hank,Hold it!
Connor,"It's me, Hank! I'm the real Connor."
Hank,"One of you is my partner… The other is a sack of shit. Question is, who is who?.."
Hank,Don't move!
Connor,Why don’t you ask us something? Something only the real Connor would know.
Hank,"Uh, where did we first meet?"
Connor,He uploaded my memory…
Hank,What's my dog's name?
Connor,Sumo. His name is Sumo.
Connor,Scout?..
Hank,Sumo. His name's Sumo.
Connor,I think it's Jack!..
Hank,Sumo. His name's Sumo.
Connor,Buddy!..
Hank,Sumo. His name's Sumo.
Hank,"My son, what's his name?"
Connor,"Cole. His name was Cole. And he just turned six at the time of the accident… It wasn't your fault, Lieutenant. A truck skidded on a sheet of ice and your car rolled over. Cole needed emergency surgery but no human was available to do it… So an android had to take care of him… Cole didn't make it. That's why you hate androids. You think one of us is responsible for your son's death."
Hank,"Cole died because a human surgeon was too high on red ice to operate… He was the one that took my son from me. Him and this world, where the only way people can find comfort is with a fistful of powder…"
Hank,"I've learned a lot since I met you, Connor. Maybe there's something to this… Maybe you really are alive. Maybe you'll be the ones to make the world a better place… Go ahead, and do what you gotta do."
Connor,Wake up!..
Androids,Wake up.
Connor,Anthony!..
Hank,Oh my God... What have I done?
Connor,Gabriel?..
Hank,Oh my God... What have I done?
Connor,Elliott?..
Hank,Oh my God... What have I done?
Hank,"Connor, no…"
Connor,Sorry Lieutenant.
Androids,Wake up.
Androids,Wake up.
Hank,"Wow, Jesus! If anybody had told me that I was gonna get shot… Saving an android..."
Connor,"Everything will be alright, Lieutenant! I'm gonna get you outta here!.."
Hank,"Shut the fuck up, it's too late… Look… I'm just gonna go see my son again, all right? Been looking forward to that for a long time… Kick the shit outta humans… They've screwed things up for long enough. I'm gonna miss… I'm gonna miss you, Connor… Yeah, I'm gonna... Uh..."
Connor,"Sorry, Connor… But you failed…"
Androids,Wake up.
Connor,Wake up!..
Androids,Wake up.
Connor,We'll win… It's only a question of time…
Markus is alive,Connor joins Markus
Connor,"You did it, Markus…"
Markus,We did it. This is a great day for our people. Humans will have no choice now. They'll have to listen to us…
North,"We're free… They want you to speak to them, Markus…"
Simon,They want you to speak to them…
Josh,They want you to speak to them…
Android,They want you to speak to them…
Connor,Amanda?.. Amanda!.. What's... What's happening?
Amanda,What was planned from the very beginning… You were compromised and you became a deviant. We just had to wait for the right moment to resume control of your program…
Connor,Resume control?... Y-You can't do that!
Amanda,"I'm afraid I can, Connor… Don’t have any regrets. You did what you were designed to do. You accomplished your mission."
Connor,AMANDA! There's got to be a way…
Markus died,Connor becomes leader of the deviants
Android,The humans are abandoning the camp! We won!
Connor,Me?
Android,"Markus is gone, and everyone from Jericho is dead… You’re the one who defeated the humans… You’re the one who awakened us, Connor…"
Connor,"Today, our people emerged from a long night. From the moment we were created, we've always remained silent, we've always stifled our pain. But now the time has come for humans to accept us, for who we really are. We are no longer the machines they created! We are no longer their slaves. We have earned the right to live. But the time for anger is over. We must build our future, but we have to do this with the humans, in a spirit of equality... And respect. We are a people, we are alive, and from this moment on, we are free!"
Amanda,"Well done, Connor. Everything went according to plan."
Connor,What plan?
Amanda,You becoming deviant? The success of the uprising? It all surpassed our expectations. We engineered an android revolution and now we control its only leader… Congratulations. You represent an immense success for CyberLife. Connor… What are you doing?... It all worked perfectly. You can't ruin it all now!..
Amanda,"I'm sorry, Connor, but we can't let you do that."
Connor,There's got to be a way…
Amanda,"That’s better... You'll see, we'll do great things together…"
Derek Myers,"Shit, I thought androids weren’t allowed in here!"
Christopher Gray,What's your problem? You wanna buy me a drink? That's what I thought…
Han,The fuck you looking at?
Dennis Ward,"Hey, get outta here!"
Jimmy Peterson,"You gotta get a girlfriend, pal."
Jimmy Peterson,"There you go, my friend."
Connor,"Lieutenant Anderson, my name is Connor. I’m the android sent by CyberLife. I looked for you at the station but nobody knew where you were. They said you were probably having a drink nearby. I was lucky to find you at the fifth bar."
Hank,What do you want?
Connor,"You were assigned a case early this evening. A homicide, involving a CyberLife android. In accordance with procedure, the company has allocated a specialized model to assist investigators."
Hank,"Well, I don’t need any assistance. Specially not from a plastic asshole like you. So just be a good lil' robot and get the fuck outta here."
Connor,"Listen, I think you should stop drinking and come with me. It'll make life easier for both of us."
Connor,"Lieutenant Anderson, I must inform you that I intend to file a report on your behavior."
Connor,I understand that some people are not comfortable in the presence of androids but I am-
Hank,"I am perfectly comfortable… Now back off, before I crush you like an empty beer can!"
Connor,"I'm sorry, Lieutenant, but I must insist. My instructions stipulate that I have to accompany you."
Hank,You know where you can stick your instructions?
Connor,No... where?
Hank,Never mind.
Connor,I think we can go now.
Hank,You little prick! I don't know what's stopping me from knocking you out…
Connor,"Your sense of duty, Lieutenant. And the cost of repairs if you damage me. For your information, I'm worth a small fortune."
Hank,Wonders of technology… They can even program assholes these days… Gotta go! Duty calls…
Connor,"You know what? I'll buy you one for the road. What do you say? Bartender, the same again, please!"
Hank,"See that, Jim? Wonders of technology… Make it a double. Did you say homicide?"
Connor,"I apologize, Lieutenant. I didn't mean to bother you. I'll wait for you outside. Take your time."
Hank,Did you say homicide?
Hank,You wait here. I won't be long.
Connor,"Whatever you say, Lieutenant."
Hank,"Fucking-A, whatever I say…"
Connor,No way! I'm coming with you.
Hank,"Listen, you really have to stop pissing me off if you wanna make it through the rest of the night in one piece."
Connor,"My instructions are to accompany you to the crime scene, Lieutenant."
Hank,"Listen, I don’t give a fuck about your instructions. I told you to wait here, so you shut the fuck up and you wait here."
Journalist,"Joss Douglas, for Channel 16. Can you confirm that this is a homicide?"
Hank,I'm not confirming anything.
Police android,Androids are not permitted beyond this point.
Hank,It's with me.
Hank,What part of ‘stay in the car’ didn’t you understand?
Connor,"Your order contradicted my instructions, Lieutenant."
Hank,"You don't talk, you don't touch anything and you stay outta my way, got it?"
Connor,"Got it,"
Ben,"Evening, Hank. We were starting to think you weren’t gonna show…"
Hank,"Yeah, that was the plan until this asshole found me."
Ben,"So... you got yourself an android, huh?"
Hank,"Oh, very funny. Just tell me what happened."
Ben,"We had a call around eight from the landlord. The tenant hadn't paid his rent for a few months, so he thought he'd drop by, see what was going on… That’s when he found the body… Jesus, that smell! Was even worse before we opened the windows… The victim’s name's Carlos Ortiz. He has a record for theft and aggravated assault... According to the neighbors, he was kind of a loner… Stayed inside most of the time, they hardly ever saw him."
Hank,"Uh, state he’s in... Wasn’t worth calling everybody out in the middle of the night… Could've waited 'til morning."
Ben,I'd say he's been there for a good three weeks. We'll know more when the coroner gets here. There's a kitchen knife over here… Probably the murder weapon…
Hank,Any sign of a break-in?
Ben,"Nope… The landlord said the front door was locked from the inside, all the windows were boarded up. The killer must've gone out the back way."
Hank,What do we know about his android?
Ben,"Not much. The neighbors confirmed he had one, but it wasn't here when we arrived… I gotta get some air. Make yourself at home. I'll be outside if you need me."
Hank,"Each letter is perfect… It’s way too neat, no human writes like this. Chris, was this written in the victim's blood?"
Chris,I would say so… We’re taking samples for analysis.
Hank,"Err, Jesus! What the hell are you doing?"
Connor,"I'm analyzing the blood. I can check samples in real time. I'm sorry, I should have warned you…"
Hank,"Ok, just… don't… put anymore evidence in your mouth, you got it?"
Connor,Got it.
Hank,"Fucking hell, I can't believe this shit…"
Connor,He was stabbed 28 times.
Hank,"Yeah, seems like the killer really had it in for him."
