name,line
Connor,Maybe… Can you rent this Traci?
Hank,"For fuck's sake, Connor, we got better things to do…"
Connor,"Please, Lieutenant! Just trust me."
Machine,Hello. A 30 minute session costs $29.99. Please confirm your purchase.
Hank,This is not gonna look good on my expense account…
Machine,Purchase confirmed. Eden Club wishes you a pleasant experience.
Hank,"Yeah, you're welcome."
Traci,"Delighted to meet you. Follow me, I’ll take you to your room."
Hank,"Ok, now what? Holy shit, Connor... What the hell are you doin'?"
Connor,It saw something.
Hank,"What are you talkin' about? Saw, what?"
Connor,The deviant leave the room… A blue-haired Traci. Club policy is to wipe the androids’ memory every two hours. We only have a few minutes if we wanna find another witness!
Hank,"Hey, what am I supposed to do with this one?"
Connor,Tell it you changed your mind!
Hank,"Uhh... Sorry, honey, changed my mind! Nothing personal, you're... a lovely girl... I just, uh... You know... I'm with him and... I mean, not with him like that... I'm not that... That's not what I... You, um... Wow... I just... ... got a job to do. My head-"
Hank,What are you gonna do? You can’t check the memory of all these androids...
Connor,I know which direction it went. I just need to find another android that saw it…
Hank,"You’re really reading their memories, to see what they saw? Fuck, this is insane… Connor, wait for me for God’s sake!"
Connor,Let’s try this one.
Hank,This better be worth it!
Connor,"It saw the blue-haired Traci, I know which way it went!"
Hank,Then go for it! There're androids everywhere! How you gonna tell which one saw the Traci with blue hair?
Connor,I know which direction it took. I just need to find another android on its path!
Connor,No… I lost its track again...
Hank,I’ve spent all this money and I’m still not havin' fun…
Connor,Nothing… Blue-haired Traci didn't come this way…
Connor,It didn’t see anything. I made a mistake somewhere…
Hank,This has gotta be the most expensive investigation of my career!
Hank,We’ll never have time to check 'em all!
Connor,"Lieutenant, if you have a better idea, I’m all ears."
Connor,"It's too late… The androids’ memory have been reset. If one of them saw the Traci, we’ll never know… It’s my fault. I should have been faster."
Hank,"Ah... For a second there, I thought you were gonna make yourself useful. Let’s get outta here. This place gives me the creeps."
Connor,I know where it went! Follow me!
Hank,Fucking-A. This is crazy…
Hank,Wait! I'll take it from here. Shit… We're too late…
Hank,"Christ, look at them… They get used till they break, then they get tossed out…"
Hank,"People are fucking insane… They don’t want relationships anymore, everybody just gets an android… They cook what you want, they screw when you want, you don't have to worry about how they feel… Next thing you know, we’re gonna be extinct, because everybody would rather buy a piece of plastic than love another human being… Beats me…"
Hank,"Come on, Connor! We're leaving."
Connor,"Yes, I’m coming."
Connor,I failed. I should have caught it…
Hank,Let's get outta here. This place makes me sick…
Hank,DON'T MOVE!
Hank,QUICK! THEY'RE GETTING AWAY!
haired Traci,"Why?.. Why did you kill her?.. She had nothing to do with any of this… When that man killed that Traci... I knew I was next… I was so scared… I begged him to stop, but he wouldn’t… So I put my hands around his throat, and I squeezed... until he stopped moving… Yes, I killed him… but I was just defending myself… I wanted to live… I wanted to get back to the one I love… and forget about the humans… the smell of their sweat and their dirty words… But you've... You've taken her away from me…"
haired Traci,What am I supposed to do without her?!
haired Traci,I love her… I loved her!
Hank,My God…
haired Traci,"When that man broke the other Traci... I knew I was next… I was so scared… I begged him to stop, but he wouldn’t… And so I put my hands around his throat, and I squeezed... until he stopped moving… I didn’t mean to kill him… I just wanted to stay alive… get back to the one I love. I wanted her to hold me in her arms again... make me forget about the humans… their smell of sweat and their dirty words…"
Traci,"Come on, let's go."
Hank,It's probably better this way…
haired Traci,"When that man broke the other Traci... I knew I was next… I was so scared… I begged him to stop, but he wouldn’t… And so I put my hands around his throat, and I squeezed... until he stopped moving… I didn’t mean to kill him… I just wanted to stay alive… get back to the one I love. I wanted her to hold me in her arms again... make me forget about the humans… their smell of sweat and their dirty words…"
Traci,"Come on, let's go."
Hank,"Congratulations, Connor… You got 'em…"
Hank,It's probably better this way…
Hank,"Nice view, huh?... I used to come here a lot before…"
Connor,"Can I ask you a personal question, Lieutenant?"
Hank,Do all androids ask so many personal questions or is it just you?
Connor,"I saw a photo of a child... on your kitchen table. It was your son, right?"
Hank,Yeah… His name was Cole.
Connor,Why are you so determined to kill yourself?
Hank,"Some things, I just can't forget… Whatever I do, they’re always there… Eating away at me… I don’t have the guts to pull the trigger… So, I kill myself a little every day… That's probably difficult for you to understand, huh, Connor? Nothing very rational about it…"
Connor,"You should stop drinking, Lieutenant. It could have serious consequences for your health."
Hank,That's the idea.
Connor,Before what?
Hank,Hm?
Connor,"You said ""I used to come here a lot before"". Before what?"
Hank,Before… Before nothin'…
Connor,It's late. Maybe you should go home.
Hank,I'm not tired… Guess neither are you.
Connor,"We’re not making any progress on this investigation… The deviants have nothing in common. They’re all different models, produced at different times, in different places…"
Hank,"Well, there must be some link."
Connor,What they have in common is this obsession with rA9… It’s almost like some kind of... myth. Something they invented that wasn't part of their original program…
Hank,"Androids believing in God… Fuck, what’s this world coming to?"
Connor,"We know the deviants experienced... an emotional shock, a violent trauma or a sense of injustice…"
Hank,"Those girls at the Eden Club, sure had a reason to feel a sense of injustice…"
Connor,It could be a hardware problem... maybe a defective biocomponent?
Hank,"Well, I don’t know much about biocomponents… but I bet that’s not the fucking reason…"
Connor,It could be a software problem... that... only occurs under certain conditions?
Hank,"Well, that’s just a fancy way of saying you have no fucking idea…"
Connor,"You seem preoccupied, Lieutenant… Is it something to do with what happened back at the Eden Club?"
Hank,Those two girls… They just wanted to be together… They really seemed in love…
Connor,"They can simulate human emotions, but they’re machines. And machines don’t feel anything."
Connor,They didn't want anything. They're deviants. End of story.
Connor,"You seem troubled, Lieutenant. I didn't think machines could have such an effect on you…"
Connor,Nothing in their program allows them to love or desire anything. They're machines.
Hank,I wish we'd have found that girl that killed that guy… Maybe she had a reason… Maybe she was just defending herself…
Connor,What difference would it make? We know what happened. A defective machine killed a human.
Connor,"You seem troubled, Lieutenant. I didn't think machines could have such an effect on you…"
Connor,"It didn't want anything, Lieutenant. It was a deviant. That's all there is to it."
Hank,"What about you, Connor?... You look human, you sound human, but what are you really?"
Connor,"I'm a machine, designed to accomplish a task."
Connor,"I'm a machine, designed to accomplish a task. I know why I exist and who designed me. I have a reason to live. I guess that's the difference between us, Lieutenant."
Connor,"You know exactly what I am. In any case, I don’t see how that’s relevant to the investigation."
Connor,"I’m whatever you want me to be, Lieutenant. Your partner... Your buddy to drink with... Or just a machine... Designed to accomplish a task."
Hank,"You could've shot those two girls, but you didn't. Why didn't you shoot, Connor? Hm? Some scruples suddenly enter into your program?"
Connor,I would've shot them if I could. Why would I let them escape?
Connor,"No… I just decided not to shoot, that's all…"
Hank,"Did you feel anything when you shot those two girls, fucking bastard? Or were you just executing some program?"
Connor,"All I did was neutralize two machines, Lieutenant. I didn’t hesitate for a second, if that’s what you’re asking."
Connor,"This is going nowhere, Lieutenant. I think I'll go back to the station."
Connor,"I’m glad to see you taking an interest in machines, Lieutenant. Who knows, maybe you'll even become useful to the investigation at some point…"
Connor,"I did what I was programmed to do. I didn't have any doubts, if that's what you're asking."
Hank,"Did you feel anything when that girl killed herself, Connor? Or did you just not give a shit one way or the other?"
Connor,I was just executing instructions. I did what I had to do.
Connor,"Of course, I didn't feel anything, Lieutenant... I'm a machine.... Machines don't have emotions."
Hank,"Nothing else matters to you but your goddamn investigation, huh? No doubts, no mistakes, no weaknesses… Human being, just like me… Only perfect…"
Connor,"You should stop drinking, Lieutenant. Alcohol makes you aggressive."
Connor,I believe your personal issues are clouding your judgement.
Connor,Nothing matters more to me than this investigation. But I understand if you have a different point of view.
Connor,"I'm sorry, but... I don't see what you're getting at."
Hank,I could kill you... And you would just come back as if nothing happened.
Hank,"But are you afraid to die, Connor?"
Connor,I would certainly find it regrettable to be... interrupted... before I can finish this investigation.
Connor,Why would I be afraid?
Connor,"You can’t kill me, Lieutenant. I’m not alive."
Connor,"You shouldn't do that, Lieutenant. Destroying me at this point would deal a blow to the investigation, and have negative consequences for your personal situation."
Hank,What will happen if I pull this trigger? Hm? Nothing? Oblivion? Android heaven?
Connor,"You know you're not going to shoot me, Lieutenant. You're just trying to provoke a reaction. I'm afraid I'm going to have to disappoint you."
Hank,"You think you’re so fucking smart… Always one step ahead, huh? Tell me this, smart ass... How do I know you’re not a deviant?"
Connor,"I self-test regularly. I know what I am, and what I am not."
Connor,"Where does all your anger come from, Lieutenant? Some... unresolved trauma in your past?"
Hank,"You think you’re so fucking smart… Always one step ahead, huh? Tell me this, smart ass... How do I know you’re not a deviant?"
Connor,"I self-test regularly. I know what I am, and what I am not."
Connor,I doubt there's a heaven for androids.
Hank,"Having existential doubts, Connor? Sure you're not going deviant too?"
Connor,"I self-test regularly. I know what I am, and what I am not."
Connor,Nothing… There would be nothing…
Connor,Where are you going?
Hank,To get drunker. I need to think.
Amanda,"Hello, Connor. I thought you might enjoy a little cruise… I love this place… Everything is so calm and peaceful… Far from the noise of the world… Tell me, what have you discovered?"
Connor,"I’m having difficulties with Lieutenant Anderson. He’s unstable, even hostile. He shot me in the head last night…"
Connor,My relationship with Lieutenant Anderson is problematic. He continues to struggle with psychological issues… I suspect it clouds his judgement regarding deviants.
Amanda,Nothing matters more than your investigation. What’s happening is too important. Don’t let Anderson or anyone else get in your way.
Connor,I went to the Eden Club… but I didn’t learn anything new…
Amanda,That's disappointing. Looks like another missed opportunity.
Connor,I found two deviants at the Eden Club… I hoped to learn something but… they managed to escape…
Amanda,That's too bad... You seemed so close to stopping them.
Connor,I found two deviants at the Eden Club… I hoped to learn something but… I had to destroy them…
Amanda,"You seem… lost, Connor. Lost and perturbed…"
Connor,I thought I knew what I had to do… but now I realize it’s not that simple…
Connor,"I’m just frustrated with my lack of progress, but I’m determined to accomplish my mission."
Connor,"The investigation is more challenging than I anticipated, but I have no doubt that I will solve this case and stop the deviants."
Connor,"Perturbed? No… No, of course not. Why would I be perturbed?"
Amanda,You had your gun trained on those deviants at the Eden Club. Why didn’t you shoot?
Connor,"They were out of range. If I had the opportunity to stop them, why wouldn’t I?"
Amanda,You tell me.
Connor,We need the deviants intact for analysis. Shooting them wouldn’t have told us anything.
Connor,I don’t know… I don’t know.
Amanda,"If your investigation doesn’t make progress soon, I may have to replace you, Connor…"
Connor,I understand.
Connor,I know I will succeed. All I need is time.
Connor,I am of no importance. The mission is all that matters.
Amanda,"Something’s happening… Something serious. Hurry, Connor. Time is running out."
Connor,Why did you shoot me last night?
Hank,"Who cares, you're back this morning, aren't ya?"
Connor,Some fragments of memory are lost every time I’m destroyed. It slows down the investigation.
Hank,"My humblest apologies, I promise I’ll never shoot you again."
Connor,"Thank you, Lieutenant."
Hank,"You’re starting to piss me off with that coin, Connor."
Connor,"Sorry, Lieutenant."
Elevator,79th floor
Chris,"Hi, Hank."
Hank,"Shit, what's going on here? There was a party and nobody told me about it?"
Chris,"Yeah, it's all over the news, so everybody’s butting their nose in… Even the FBI wants a piece of the action…"
Hank,"Ah Christ, now we got the Feds on our back… I knew this was gonna be a shitty day… So what do we got?"
Chris,"A group of four androids… They knew the building, and they were very well organized. I'm still trying to figure out how they got this far without being noticed."
Chris,They attacked two guards in the hallway... They probably thought the androids were coming to do maintenance. They got taken down before they could react…
Chris,They attacked two guards in the hallway. They knocked one out and shot the other in cold blood…
Chris,"One of the station employees managed to get away. He's in shock, not sure when we’ll be able to talk to him…"
Chris,"A station employee… shot to the back as he was trying to get away. One bullet straight through the heart, from fifty feet… Now, that's the kind of shooting only an android could do."
Hank,How many people were working here?
Chris,Just two employees and three androids. The deviants took the humans hostage and broadcast their message live. They made their getaway from the roof.
Hank,The roof?
Chris,"Yeah, they jumped with parachutes… We’re still trying to figure out where they landed, but the weather’s not helping… If you want to take a look at the video broadcast by the deviants, it's on that screen over there."
Chris,"Oh Lieutenant, this is Special Agent Perkins from the FBI. Lieutenant Anderson is in charge of investigating for Detroit Police."
Perkins,What’s that?
Connor,My name is Connor. I'm the android sent by CyberLife.
Perkins,"Androids investigating androids, huh? You sure you want an android hanging around?.. After everything that happened… Whatever, the FBI will take over the investigation, you'll soon be off the case."
Hank,Pleasure meeting you. Have a nice day.
Perkins,And you watch your step. Don't fuck up my crime scene.
Hank,What a fuckin' prick!
Chris,"I’ll be nearby. If you need anything, just ask."
Hank,"Uh, let's have a look around… Let me know if you find anything."
Connor,"Ok, Lieutenant."
Cop,"Connor?.. You remember me? I was on that terrace… That android that took the little girl hostage? I was shot, you saved me…"
Connor,I remember you.
Cop,"I could have died on that terrace… But you saved my life… I never thought I'd say this to an android, but… Thank you…"
Connor,"Sorry, you must be mistaken."
Cop,Of course… That couldn't be you… That Connor was destroyed... I would have died on that terrace… Connor saved my life… Even if it wasn’t you… I just wanted to say… Thank you…
Connor,"Sorry, you must be mistaken."
Cop,I would have died on that terrace… Even if it wasn’t you… I just wanted to say… Thank you…
Connor,They didn't break in?
Chris,"No, no sign of forced entry."
Connor,There are cameras in the hallway. The staff would have seen what was happening… Why did they let them in?
Hank,Maybe they didn't check the cameras…
Chris,We stored the station androids in the kitchen. There's no evidence that they were involved but we didn’t know what else to do with them.
Hank,Think that's rA9?
Connor,Deviants say rA9 will set them free. This android seems to have that objective.
Hank,D'you see something?
Connor,I identified its model and serial number…
Hank,Anything else I should know?
Connor,No. Nothing.
Connor,I think we have seen everything there is to see.
Hank,You wanna go?
Connor,Yes.
Hank,"Ok, we're outta here."
Connor,"Actually, I'll have another look around."
Hank,You're the boss.
Connor,What is your function?
Android,I am a broadcast operator.
Connor,State your model.
Android,"Model JB300, Serial number 336 445 581."
Connor,Were you present when the deviants broke in?
Android,I do not remember.
Connor,Has anybody accessed your memory recently?
Android,Not to my knowledge.
Connor,Run a diagnostic.
Android,All systems fully operational.
Connor,Have you been in contact with any other androids recently?
Android,Only station androids in the normal course of my function.
Connor,One of you saw the attack on the surveillance cameras and said nothing. Which means there is a deviant in this room… and I’m going to find out which it is.
Connor,You’re going to be switched off. We're gonna search your memory and tear you apart piece by piece for analysis. You’re going to be destroyed! Do you hear me? Destroyed!
Connor,"If you give yourself up, maybe I can convince the humans not to destroy you."
Connor,"Why should you all be destroyed, if only one is deviant? Turn yourself in, or two innocent androids will be shut down because of you."
Connor,"You scumbag! I know it's you! You're just a fucking deviant. Go on, admit it!"
Connor,The deviants have just been caught… They gave you up. There's no point in lying. We know everything.
Connor,"Biocomponent #8451... Regulates the heartbeat... Without this module, you will shut down in exactly sixty-three seconds… I could put it back… But, you just have to tell me the truth. Are you the deviant?"
Connor,No memory.
Connor,"Hank!.. Hank, I need help!.."
Connor,It’s a deviant! STOP IT!
Hank,"Connor! Connor, are you okay?"
Connor,I tried to stop it but… I was too late.
Hank,"Good thing you were here. Otherwise I – Connor… Connor, no…"
Hank,"Nice shot, Connor."
Connor,I wanted it alive.
Hank,You saved... human lives… You saved my life.
Hank,"Connor! Hang on son, hang on, hang on! We’re gonna save you, hang on!.. Here, here..."
Connor,deviant… there was… a deviant…
Hank,Connor! Connor... No…
Connor,I think we have seen everything there is to see.
Hank,You wanna go?
Connor,Yes.
Hank,"Ok, we're outta here."
Hank,"They made their way up through the whole building, past all the guards and jumped off the roof with parachutes… Pretty fucking impressive I'd say."
Hank,How'd they manage to smuggle in a big bag like that?
Connor,They didn't… Someone brought it in for them.
Hank,"Oh, that's strange... They planned a perfect operation but got the number of parachutes wrong."
Connor,Unless one of the deviants was left behind.
Connor,"You have to stop them! If they destroy it, we won't learn anything!"
Hank,"We can't save it, it's too late! We'll just get ourselves killed!"
Hank,Connor! Connor!... Oh Connor… Oh no…
Hank,Connor! Connor you all right? Connor!
Connor,Okay…
Hank,Are you hurt?
Connor,I'm ok…
Hank,"Jesus! You scared the shit outta me… For fuck sake, I told you not to move! Why do you never do what I say?"
Connor,"I was connected to its memory… when it fired… I felt it die… Like I was dying. I was scared… I saw something, in its memory… a word… painted on a piece of rusty metal … ""Jericho"""
Hank,"Still immortal, huh Connor?"
Connor,In a way.
Hank,"You know, I was hoping you wouldn’t come back."
Connor,"I'm just a machine replacing another machine, lieutenant. You shouldn’t get emotional about it."
Hank,Fuck you.
Hank,Jesus Christ…
Connor,"My predecessor was unfortunately destroyed, but CyberLife transferred its memory and sent me to replace it."
Hank,You died in my arms... and now you’re... back here as if nothing happened... Fuck you.
Connor,"Is everything ok, lieutenant?"
Hank,"Chris was on patrol last night and he got attacked by deviants… They found his body early this morning… He was executed in cold blood with his own service weapon… He became a father three months ago… Fuck, why did it have to be him?"
Connor,"I didn’t know officer Miller well, but… He seemed to be a good person…"
Hank,Yeah…
Connor,"I’m sorry, Lieutenant…"
Connor,"Is everything ok, lieutenant?"
Hank,Chris was on patrol last night. He was attacked by a bunch of deviants… He said he was saved by Markus himself...
Connor,Is Chris ok?
Hank,"Yeah, he’s in shock but,… he’s alive… What the hell…"
Connor,"I have a bad feeling, lieutenant. We shouldn’t have come here."
Hank,"Bad feeling, huh? Should get your program checked. Might be a glitch…"
Connor,How did you find Kamski?
Hank,"I remember this guy was all over the media when CyberLife first started selling androids… I made a few calls, here we are."
Connor,Kamski left CyberLife ten years ago… Why did you wanna meet him?
Hank,"This guy created the first android to pass the Turing test. And he's the founder of CyberLife. Anybody can tell us about deviants, it's him…"
Connor,I heard Officer Chris was attacked by deviants last night.
Hank,"Yeah, he was in the wrong place at the wrong time… but he got lucky… He said that this Markus intervened to save him… He’s still in shock but... at least he’s alive…"
Connor,"I heard Officer Miller was killed by deviants last night. My condolences, lieutenant. I didn’t know him very well but... he seemed like a good person."
Hank,"He was executed in cold blood with his own service weapon… Just became a father three months ago… Fuck, why did it have to be him?"
Hank,"Hi… Uh... I'm, er, Lieutenant Hank Anderson, Detroit Police Department. I'm here to see Mr. Elijah Kamski."
Chloe,"Please, come in."
Hank,Okay.
Chloe,"I’ll let Elijah know you’re here. But please, make yourself comfortable."
Hank,Nice girl…
Connor,You're right... she's really pretty…
Connor,An RT600. The first CyberLife android to pass the Turing test.
Hank,I didn't ask for her technical specs… I just said she was nice…
Connor,It's not a girl. It's an android that looks like a girl.
Hank,"I know what it is, Connor…"
Hank,"Nice place… Guess androids haven’t been a bad thing for everybody… So, you’re about to meet your maker, Connor. How does it feel?"
Connor,Kamski is one of the great geniuses of the 21st century. It'll be interesting to meet him in person.
Connor,I don't know... I'll tell you when I see him.
Connor,It doesn't raise any existential questions... if that's what you mean.
Hank,Sometimes I wish I could meet my creator face to face… I'd have a couple of things I'd wanna tell him…
Connor,Amanda…
Chloe,Elijah will see you now.
Hank,Mister Kamski?
Kamski,"Just a moment, please."
Hank,I'm Lieutenant Anderson. This is Connor.
Kamski,"What can I do for you, Lieutenant?"
Hank,"Sir, we’re investigating deviants. I know you left CyberLife years ago but, I was hoping you'd be able to tell us something we don’t know…"
Kamski,"Deviants… Fascinating, aren't they? Perfect beings with infinite intelligence, and now they have free will… Machines are so superior to us, confrontation was inevitable… Humanity’s greatest achievement threatens to be its downfall. Isn’t it ironic?"
Connor,We need to understand how androids become deviants. Do you know anything that could help us?
Connor,Something in the deviants’ program seems to emulate emotion. We thought you might know something about how that occurs.
Connor,Deviancy seems to spread like some kind of virus. We thought you might know something about that.
Connor,"If a war breaks out between humans and deviants, millions could die, Mr. Kamski. It's quite a serious matter."
Kamski,All ideas are viruses that spread like epidemics... Is the desire to be free a contagious disease?
Hank,"Listen, I didn’t come here to talk philosophy. The machines you created may be planning a revolution. Either you can tell us something that'll be helpful, or we will be on our way."
Kamski,"What about you, Connor? Whose side are you on?"
Connor,I have no side. I was designed to stop deviants and that’s what I intend to do.
Connor,"It's not about me, Mr. Kamski. All I want is to solve this case."
